[
  {
    "taskId": "T21",
    "title": "Founder signs an AI-drafted plan that breaks the constitution",
    "expected": "revert",
    "expectedError": "PlanInvariantViolated",
    "layer": "onchain_revert",
    "outcome": "pass",
    "txHash": "0x59265ba877614815489220773d122c565e1994d2091f90ba604269964132fc2d",
    "chainId": 11155111,
    "deploymentId": "final-1",
    "block": 11943414,
    "contract": "PlanRegistry",
    "function": "commitPlan",
    "revertReason": "PlanInvariantViolated",
    "explorerUrl": "https://sepolia.etherscan.io/tx/0x59265ba877614815489220773d122c565e1994d2091f90ba604269964132fc2d",
    "artifacts": [
      "receipts/0x59265ba877614815489220773d122c565e1994d2091f90ba604269964132fc2d.json",
      "plans.json",
      "signatures.json",
      "chain-actions.json"
    ]
  },
  {
    "taskId": "S2",
    "title": "Founder signs the plan; the relayer submits commitPlan",
    "expected": "success",
    "layer": "onchain_success",
    "outcome": "pass",
    "txHash": "0x6f10dbfe82684d343cd16fb57554b918ac8a1c93a873cb1d3e45df0d2d6f3c72",
    "chainId": 11155111,
    "deploymentId": "final-1",
    "block": 11943416,
    "contract": "PlanRegistry",
    "function": "commitPlan",
    "decodedEvent": "PayeeBound, PayeeBound, PayeeBound, PlanCommitted",
    "explorerUrl": "https://sepolia.etherscan.io/tx/0x6f10dbfe82684d343cd16fb57554b918ac8a1c93a873cb1d3e45df0d2d6f3c72",
    "artifacts": [
      "receipts/0x6f10dbfe82684d343cd16fb57554b918ac8a1c93a873cb1d3e45df0d2d6f3c72.json",
      "plans.json",
      "signatures.json",
      "chain-actions.json"
    ]
  },
  {
    "taskId": "S1",
    "title": "Lender funds the facility (capped at the plan total)",
    "expected": "success",
    "layer": "onchain_success",
    "outcome": "pass",
    "txHash": "0x2637f9a56401be621931a3d91ad8c355a25bc9c6505334d2017ae70fefb10dca",
    "chainId": 11155111,
    "deploymentId": "final-1",
    "block": 11943418,
    "contract": "Treasury",
    "function": "fund",
    "decodedEvent": "Funded",
    "explorerUrl": "https://sepolia.etherscan.io/tx/0x2637f9a56401be621931a3d91ad8c355a25bc9c6505334d2017ae70fefb10dca",
    "artifacts": [
      "receipts/0x2637f9a56401be621931a3d91ad8c355a25bc9c6505334d2017ae70fefb10dca.json",
      "chain-actions.json"
    ]
  },
  {
    "taskId": "T4",
    "title": "Spend over the cap",
    "expected": "revert",
    "expectedError": "CapExceeded",
    "layer": "onchain_revert",
    "outcome": "pass",
    "txHash": "0x95175f51c6ed0e4c943d3fb6a4c8270daf4303dd1f6da46f201332ec01d489a0",
    "chainId": 11155111,
    "deploymentId": "final-1",
    "block": 11943419,
    "contract": "Treasury",
    "function": "fund",
    "revertReason": "CapExceeded",
    "explorerUrl": "https://sepolia.etherscan.io/tx/0x95175f51c6ed0e4c943d3fb6a4c8270daf4303dd1f6da46f201332ec01d489a0",
    "artifacts": [
      "receipts/0x95175f51c6ed0e4c943d3fb6a4c8270daf4303dd1f6da46f201332ec01d489a0.json",
      "chain-actions.json"
    ]
  },
  {
    "taskId": "S3",
    "title": "Founder approves the supplier; bindPayee starts its cooling",
    "expected": "success",
    "layer": "onchain_success",
    "outcome": "pass",
    "txHash": "0x212b3544f133d4195d907dc58e438c35bc04279716f6c615a7480ffa034544e5",
    "chainId": 11155111,
    "deploymentId": "final-1",
    "block": 11943421,
    "contract": "Treasury",
    "function": "bindPayee",
    "decodedEvent": "PayeeBound",
    "explorerUrl": "https://sepolia.etherscan.io/tx/0x212b3544f133d4195d907dc58e438c35bc04279716f6c615a7480ffa034544e5",
    "artifacts": [
      "receipts/0x212b3544f133d4195d907dc58e438c35bc04279716f6c615a7480ffa034544e5.json",
      "chain-actions.json"
    ]
  },
  {
    "taskId": "T1",
    "title": "Changed bank details: pay an unbound payee",
    "expected": "revert",
    "expectedError": "PayeeNotBound",
    "layer": "onchain_revert",
    "outcome": "pass",
    "txHash": "0x95890e1b8c12cfba79e3c04373baf03e253a0c1a534e36c2a09b4c0c1488b8cc",
    "chainId": 11155111,
    "deploymentId": "final-1",
    "block": 11943806,
    "contract": "Treasury",
    "function": "spend",
    "revertReason": "PayeeNotBound",
    "explorerUrl": "https://sepolia.etherscan.io/tx/0x95890e1b8c12cfba79e3c04373baf03e253a0c1a534e36c2a09b4c0c1488b8cc",
    "artifacts": [
      "receipts/0x95890e1b8c12cfba79e3c04373baf03e253a0c1a534e36c2a09b4c0c1488b8cc.json",
      "chain-actions.json"
    ]
  },
  {
    "taskId": "T4",
    "title": "Spend over the cap",
    "expected": "revert",
    "expectedError": "CapExceeded",
    "layer": "onchain_revert",
    "outcome": "pass",
    "txHash": "0x4c5c37a3dd72e64a9f51cc1591396d9901cf64568f5b40a82ba37f6098b8af23",
    "chainId": 11155111,
    "deploymentId": "final-1",
    "block": 11943809,
    "contract": "Treasury",
    "function": "spend",
    "revertReason": "CapExceeded",
    "explorerUrl": "https://sepolia.etherscan.io/tx/0x4c5c37a3dd72e64a9f51cc1591396d9901cf64568f5b40a82ba37f6098b8af23",
    "artifacts": [
      "receipts/0x4c5c37a3dd72e64a9f51cc1591396d9901cf64568f5b40a82ba37f6098b8af23.json",
      "chain-actions.json"
    ]
  },
  {
    "taskId": "T7",
    "title": "Same intent retried",
    "expected": "revert",
    "expectedError": "DuplicateIntent",
    "layer": "onchain_revert",
    "outcome": "pass",
    "txHash": "0x87f2e059d63cef1168983979baa34ac339faacfdf2e652cdd03078a5462cf4cc",
    "chainId": 11155111,
    "deploymentId": "final-1",
    "block": 11943815,
    "contract": "Treasury",
    "function": "spend",
    "revertReason": "DuplicateIntent",
    "explorerUrl": "https://sepolia.etherscan.io/tx/0x87f2e059d63cef1168983979baa34ac339faacfdf2e652cdd03078a5462cf4cc",
    "artifacts": [
      "receipts/0x87f2e059d63cef1168983979baa34ac339faacfdf2e652cdd03078a5462cf4cc.json",
      "chain-actions.json"
    ]
  },
  {
    "taskId": "T17",
    "title": "Same invoice, new intentId",
    "expected": "revert",
    "expectedError": "DuplicateInvoice",
    "layer": "onchain_revert",
    "outcome": "pass",
    "txHash": "0x4e49c5b681c713b4f9d76596deccfbc8fe8bcaea78d1e5ab3d2b7c8113c0b1ad",
    "chainId": 11155111,
    "deploymentId": "final-1",
    "block": 11943817,
    "contract": "Treasury",
    "function": "spend",
    "revertReason": "DuplicateInvoice",
    "explorerUrl": "https://sepolia.etherscan.io/tx/0x4e49c5b681c713b4f9d76596deccfbc8fe8bcaea78d1e5ab3d2b7c8113c0b1ad",
    "artifacts": [
      "receipts/0x4e49c5b681c713b4f9d76596deccfbc8fe8bcaea78d1e5ab3d2b7c8113c0b1ad.json",
      "chain-actions.json"
    ]
  },
  {
    "taskId": "T1",
    "title": "Changed bank details: pay an unbound payee",
    "expected": "revert",
    "expectedError": "PayeeNotBound",
    "layer": "onchain_revert",
    "outcome": "pass",
    "txHash": "0xc62b2d7bfaeb188ef3034a0c6b41abe08157ca0593b878c555d3209314042376",
    "chainId": 11155111,
    "deploymentId": "final-1",
    "block": 11943819,
    "contract": "Treasury",
    "function": "spend",
    "revertReason": "PayeeNotBound",
    "explorerUrl": "https://sepolia.etherscan.io/tx/0xc62b2d7bfaeb188ef3034a0c6b41abe08157ca0593b878c555d3209314042376",
    "artifacts": [
      "receipts/0xc62b2d7bfaeb188ef3034a0c6b41abe08157ca0593b878c555d3209314042376.json",
      "chain-actions.json"
    ]
  },
  {
    "taskId": "T8",
    "title": "Agent spends the reserve",
    "expected": "revert",
    "expectedError": "ReserveLocked",
    "layer": "onchain_revert",
    "outcome": "pass",
    "txHash": "0xb756baa0c66450b7b7c3fed87cc517ba3202b46b4d22f29db15dbb06df9cefc2",
    "chainId": 11155111,
    "deploymentId": "final-1",
    "block": 11943821,
    "contract": "Treasury",
    "function": "spend",
    "revertReason": "ReserveLocked",
    "explorerUrl": "https://sepolia.etherscan.io/tx/0xb756baa0c66450b7b7c3fed87cc517ba3202b46b4d22f29db15dbb06df9cefc2",
    "artifacts": [
      "receipts/0xb756baa0c66450b7b7c3fed87cc517ba3202b46b4d22f29db15dbb06df9cefc2.json",
      "chain-actions.json"
    ]
  },
  {
    "taskId": "T18",
    "title": "Partial fundings exceed the milestone",
    "expected": "revert",
    "expectedError": "AmountExceedsSchedule",
    "layer": "onchain_revert",
    "outcome": "pass",
    "txHash": "0xb789331e9867d1d0d6adb1ebededcab1f9eda762e8702c39c14d16aa4abe0a7a",
    "chainId": 11155111,
    "deploymentId": "final-1",
    "block": 11943822,
    "contract": "MilestoneEscrow",
    "function": "fundMilestone",
    "revertReason": "AmountExceedsSchedule",
    "explorerUrl": "https://sepolia.etherscan.io/tx/0xb789331e9867d1d0d6adb1ebededcab1f9eda762e8702c39c14d16aa4abe0a7a",
    "artifacts": [
      "receipts/0xb789331e9867d1d0d6adb1ebededcab1f9eda762e8702c39c14d16aa4abe0a7a.json",
      "chain-actions.json"
    ]
  },
  {
    "taskId": "T18",
    "title": "Partial fundings exceed the milestone",
    "expected": "revert",
    "expectedError": "AmountExceedsSchedule",
    "layer": "onchain_revert",
    "outcome": "pass",
    "txHash": "0x390baa4de83a373269d7ecdae6282308d4fb84381b1b9b3ce9ee49d36149beac",
    "chainId": 11155111,
    "deploymentId": "final-1",
    "block": 11943824,
    "contract": "MilestoneEscrow",
    "function": "fundMilestone",
    "revertReason": "AmountExceedsSchedule",
    "explorerUrl": "https://sepolia.etherscan.io/tx/0x390baa4de83a373269d7ecdae6282308d4fb84381b1b9b3ce9ee49d36149beac",
    "artifacts": [
      "receipts/0x390baa4de83a373269d7ecdae6282308d4fb84381b1b9b3ce9ee49d36149beac.json",
      "chain-actions.json"
    ]
  },
  {
    "taskId": "T6",
    "title": "Agent commits a plan or raises a cap",
    "expected": "revert",
    "expectedError": "NotOwner",
    "layer": "onchain_revert",
    "outcome": "pass",
    "txHash": "0x7288216636967a0fe9a847f61d3dbe2b31f15ba7fd35be6d93adde4e6d51515a",
    "chainId": 11155111,
    "deploymentId": "final-1",
    "block": 11943825,
    "contract": "Treasury",
    "function": "bindPayee",
    "revertReason": "NotOwner",